Team/Project/Department name, ACL file, Resource prefix (cluster_name+team_project_abbreviation), Approver GitHub username, Contact endpoint, Service account principals
Kafka Admins, main.yml, FER_ADM_, hrvoje459, hrvoje.rom@fer.hr, "ADM_broker1,ADM_broker2,ADM_broker3,ADM_ksm"
ZEMRIS, main.yml, FER_ZEMRIS_, hrvoje459, hrvoje.rom@fer.hr, "ZEMRIS_service_acc_1"
ZTEL, main.yml, FER_ZTEL_, hrvoje459, hrvoje.rom@fer.hr, "ZTEL_service_acc_1,ZTEL_service_acc_2"
ZPR, main.yml, FER_ZPR_, hrvojerom, hrvoje.rom@fer.hr, "ZPR_velika_racunica"
ZKITS, main.yml, FER_ZKIST_, hrvoje459, hrvoje.rom@fer.hr, "ZKIST_velika_raketa,ZKIST_raketni_sustav"
Avengers, main.yml, FER_AVRS_, hrvojerom, hrvoje.rom@fer.hr, "AVRS_petar_paukovic,AVRS_stjepan_cudnovati,AVRS_nada_osacic"
The Boys, main.yml, FER_BYS_, hrvoje459, hrvoje.rom@fer.hr, "BYS_bili_mesar"